{"artifacts":[{"artifact_id":"dataset-profile","content_sha256":"abf5442d649fb30b0c1513b13c1c8482b8dbac69954833d38ce31ed9b0b81aa3","role":"dataset_profile_descriptor","schema_id":"sidscope.dataset_profile_descriptor.v1","schema_revision":"1.0.0"}],"content_sha256":"0d8f86599570680ea062ade8dffebac327e7b1f44b8bbcc04a3bb243cc9039c8","decision":{"status":"pass","status_label":"named_adapter"},"descriptor_binding":{"content_sha256":"abf5442d649fb30b0c1513b13c1c8482b8dbac69954833d38ce31ed9b0b81aa3","schema_id":"sidscope.dataset_profile_descriptor.v1","schema_revision":"1.0.0"},"gates":[{"failure":null,"gate_id":"G0","status":"pass"},{"failure":null,"gate_id":"G1","status":"pass"},{"failure":null,"gate_id":"G2","status":"pass"},{"failure":null,"gate_id":"G3","status":"pass"},{"failure":null,"gate_id":"G4","status":"pass"},{"failure":null,"gate_id":"G5","status":"pass"}],"producer":{"name":"sidscope.profile-engine","version":"1.5.0.dev0"},"profile_binding":{"catalog_sha256":"7f90a7407fb65a5dc5a74df093149f598f7dce92bc45bde04a3a640c74d8c404","profile_id":"generator_g0_g5","profile_revision":"1.0.0"},"report_id":"report:external-parallel","schema":"sidscope.profile_conformance_report.v1","schema_revision":"1.0.0"}
